RuleId,Description,Action,Status,Exclusions,RuleGroup,RuleSet
944120,Possible payload execution and                                remote command execution,Anomaly score,Enabled,,REQUEST-944-APPLICATION-ATTACK-JAVA,OWASP_3.2
944130,Suspicious Java classes,Anomaly score,Enabled,,REQUEST-944-APPLICATION-ATTACK-JAVA,OWASP_3.2
944200,Exploitation of Java                                deserialization Apache Commons,Anomaly score,Enabled,,REQUEST-944-APPLICATION-ATTACK-JAVA,OWASP_3.2
944210,Possible use of Java                                serialization,Anomaly score,Enabled,,REQUEST-944-APPLICATION-ATTACK-JAVA,OWASP_3.2
944240,Remote Command Execution: Java                                serialization,Anomaly score,Enabled,,REQUEST-944-APPLICATION-ATTACK-JAVA,OWASP_3.2
944250,Remote Command Execution:                                Suspicious Java method detected,Anomaly score,Enabled,,REQUEST-944-APPLICATION-ATTACK-JAVA,OWASP_3.2
800100,"Rule to help detect and                                mitigate log4j vulnerability - CVE-2021-44228,                                CVE-2021-45046",Anomaly score,Enabled,,Known-CVEs,OWASP_3.2
800110,Spring4Shell Interaction                                Attempt,Anomaly score,Enabled,,Known-CVEs,OWASP_3.2
800111,Attempted Spring Cloud                                routing-expression injection - CVE-2022-22963,Anomaly score,Enabled,,Known-CVEs,OWASP_3.2
800112,Attempted Spring Framework                                unsafe class object exploitation - CVE-2022-22965,Anomaly score,Enabled,,Known-CVEs,OWASP_3.2
800113,Attempted Spring Cloud Gateway                                Actuator injection - CVE-2022-22947,Anomaly score,Enabled,,Known-CVEs,OWASP_3.2
800114,Attempted Apache Struts file                                upload exploitation - CVE-2023-50164,Log,Enabled,,Known-CVEs,OWASP_3.2
